{
  "schema_version": "falsify.understanding.v1",
  "generation_status": "available",
  "audit_context": {
    "review_schema_version": "falsify.review.v1",
    "verdict": "BLOCK",
    "authority_ceiling": "EPISTEMIC_CLAIM",
    "claim_scope": "document_logic",
    "receipt_hash": "2d5dbdf8c2ff92f08a65d7171745eab64ec310969f32b593080cd5800a7fcbfc"
  },
  "scope": {
    "inputs": [
      "subject text of this review",
      "structured review receipt (findings/verdict/authority)",
      "3 explicit supplementary material(s), not verified by this review",
      "user pre-review words"
    ],
    "not_covered": [
      "live system state at reading time",
      "verification of supplementary materials beyond this review's scope",
      "re-execution of the project or its code",
      "any change to the original verdict/authority/exit code"
    ],
    "note": "Association with the receipt proves linkage, not authority validation."
  },
  "sources": [
    {
      "id": "SUBJECT",
      "role": "subject",
      "kind": "document",
      "origin_path": "C:\\Users\\CHRIS\\Documents\\New project\\Falsify\\.tmp\\project-understanding-demo\\subject.md",
      "bytes_sha256": "6d6b3c49fb0848f5b2360a4709aa88d81a05aceb6843da15370d27457df84a0b",
      "content_state": "withheld",
      "text_sha256": "",
      "text": ""
    },
    {
      "id": "RECEIPT",
      "role": "receipt",
      "kind": "review_receipt",
      "origin_path": "(in-memory review payload)",
      "bytes_sha256": "2d5dbdf8c2ff92f08a65d7171745eab64ec310969f32b593080cd5800a7fcbfc",
      "content_state": "included",
      "text": "===== RECEIPT (structured; part of input) =====\nverdict: BLOCK\nauthority_ceiling: EPISTEMIC_CLAIM\nclaim_scope: document_logic\nrisk_tier: normal\nfinding[0] cutline=Delete severity=low issue=Structural surface ok.\nfinding[1] cutline=Must Fix severity=high issue=Weekly window not independently verified; export rows may fall outside the requested range.\nfinding[2] cutline=Known Debt severity=medium issue=Currency rate table has no effective-date check; stale rate silently reused.\n===== END RECEIPT =====",
      "text_sha256": "a30b1e2fb8b205fea307ef52cb8471d876f378670a6198c825f2549f87807a67"
    },
    {
      "id": "ARCH",
      "role": "material",
      "kind": "document",
      "origin_path": "C:\\Users\\CHRIS\\Documents\\New project\\Falsify\\tests\\fixtures\\understanding\\rich\\architecture.md",
      "bytes_sha256": "6d035917763378df11231feea643024fbd4c18c3758a2fe4041ea981f3865a9f",
      "content_state": "withheld",
      "text_sha256": "",
      "text": ""
    },
    {
      "id": "CODE",
      "role": "material",
      "kind": "code",
      "origin_path": "C:\\Users\\CHRIS\\Documents\\New project\\Falsify\\tests\\fixtures\\understanding\\rich\\billing.py",
      "bytes_sha256": "a2125b69357ab273639173f50ec41a3f02eab4667965cd99894397abd15323c0",
      "content_state": "withheld",
      "text_sha256": "",
      "text": ""
    },
    {
      "id": "PROBE",
      "role": "material",
      "kind": "raw_output",
      "origin_path": "C:\\Users\\CHRIS\\Documents\\New project\\Falsify\\tests\\fixtures\\understanding\\rich\\probe-output.txt",
      "bytes_sha256": "b43c7bd3143f532603f522aaa87df56cc5f6a33319a37d07502346272c9336a7",
      "content_state": "withheld",
      "text_sha256": "",
      "text": ""
    },
    {
      "id": "BEFORE",
      "role": "user_before",
      "kind": "document",
      "origin_path": "(user before input)",
      "bytes_sha256": "d757e043a26a766adf5a90a2c218c5c9238437bca336f795f9d6b4a21abeffeb",
      "content_state": "withheld",
      "text_sha256": "",
      "text": ""
    }
  ],
  "project_model": {
    "goal": {
      "text": "Turn weekly platform order exports into a finance-ready billing table.",
      "epistemic_status": "source_observation",
      "refs": [
        {
          "source_id": "SUBJECT",
          "start_line": 1,
          "end_line": 3,
          "quote": "The pipeline fetches orders, applies refunds, and renders the report."
        }
      ]
    },
    "mechanism_chain": [
      {
        "text": "Raw order events are pulled from the platform export.",
        "epistemic_status": "source_observation",
        "refs": [
          {
            "source_id": "ARCH",
            "start_line": 7,
            "end_line": 7,
            "quote": "`fetch_orders()` pulls raw order events"
          }
        ]
      },
      {
        "text": "Refunds are split into pre-shipment and post-shipment buckets.",
        "epistemic_status": "source_observation",
        "refs": [
          {
            "source_id": "ARCH",
            "start_line": 8,
            "end_line": 8,
            "quote": "`apply_refunds()` splits refunds into pre-shipment and post-shipment buckets"
          }
        ]
      },
      {
        "text": "The weekly table renders from the split results; window correctness is assumed, not checked.",
        "epistemic_status": "inference",
        "refs": [
          {
            "source_id": "PROBE",
            "start_line": 4,
            "end_line": 5,
            "quote": "rows outside requested window: 391"
          }
        ]
      }
    ],
    "assumptions": [
      {
        "text": "The platform export covers exactly the requested window.",
        "epistemic_status": "claim",
        "refs": [
          {
            "source_id": "ARCH",
            "start_line": 13,
            "end_line": 13,
            "quote": "The platform export is assumed complete for the requested window"
          }
        ],
        "if_wrong": "weekly totals silently include or miss rows (probe saw 391 outside-window rows)"
      },
      {
        "text": "Refund status is final once the export marks it settled.",
        "epistemic_status": "claim",
        "refs": [
          {
            "source_id": "ARCH",
            "start_line": 14,
            "end_line": 14,
            "quote": "Refund status is assumed final once the export marks it settled"
          }
        ],
        "if_wrong": "late refunds leak between weeks and totals drift"
      },
      {
        "text": "The rate table in use is current for the report month.",
        "epistemic_status": "claim",
        "refs": [
          {
            "source_id": "CODE",
            "start_line": 21,
            "end_line": 21,
            "quote": "return RATE_TABLE.get(month_key) or list(RATE_TABLE.values())[-1]"
          }
        ],
        "if_wrong": "stale currency conversion silently misstates amounts"
      }
    ]
  },
  "findings_explained": [
    {
      "finding_index": 1,
      "text": "The 391 out-of-window rows measured by the probe mean weekly totals are computed over a fuzzy window, so 'numbers match the platform' is not yet a safe statement.",
      "epistemic_status": "source_observation",
      "refs": [
        {
          "source_id": "PROBE",
          "start_line": 4,
          "end_line": 4,
          "quote": "rows outside requested window: 391  (0.94%)"
        }
      ],
      "original_severity": "high",
      "original_cutline": "Must Fix"
    },
    {
      "finding_index": 2,
      "text": "rate_for() falls back to the last dict entry for unknown months, so a stale table is used without error — the Known Debt is a real silent failure mode.",
      "epistemic_status": "source_observation",
      "refs": [
        {
          "source_id": "CODE",
          "start_line": 21,
          "end_line": 21,
          "quote": "return RATE_TABLE.get(month_key) or list(RATE_TABLE.values())[-1]"
        }
      ],
      "original_severity": "medium",
      "original_cutline": "Known Debt"
    }
  ],
  "unknowns": [
    {
      "text": "Whether long windows get silently truncated by the export API.",
      "kind": "missing_evidence",
      "impact": "weekly totals could be systematically low",
      "next_evidence": "row-count parity check against platform UI for one week"
    },
    {
      "text": "How often late refunds settle after the export marks them settled.",
      "kind": "not_reviewed",
      "impact": "week-over-week totals may not be additive",
      "next_evidence": "refund status changelog sample over 4 weeks"
    }
  ],
  "suggested_revisions": [],
  "reflection_prompts": [
    {
      "id": "prompt1",
      "question": "如果平台把导出从「滚动 7 天」切换成「自然周」，哪个假设最先失效，哪个数字会最先暴露差异？（推演，非实测）"
    },
    {
      "id": "prompt2",
      "question": "如果汇率表一个月没更新，报告里哪些列会错、错多少取决于什么？（推演，非实测）"
    }
  ],
  "user_notes": {
    "before_recorded": null,
    "answers": [],
    "revision_states": []
  },
  "generation_meta": {
    "tool": "falsify.understanding",
    "generated_at": "2026-10-07T13:25:03Z",
    "provider": "",
    "model": "",
    "base": "",
    "completion_meta": {
      "finish_reason": "stop"
    },
    "error_category": "none"
  }
}